{
  "$schema": "http://json-schema.org/draft-07/schema#",
  "$id": "https://github.com/yanny7/AdvancedLootInfo/blob/master/scripts/supported_mods.schema.json",
  "title": "ALICompat Supported Mods Schema",
  "description": "Minecraft-version-agnostic registry of every mod ALICompat provides support for (scripts/supported_mods.json). scripts/check_versions.py and scripts/modpack.py read it as their source of truth; gradle.properties holds only what the current branch resolves from it.",
  "type": "array",
  "items": {
    "type": "object",
    "additionalProperties": false,
    "required": [
      "key",
      "name",
      "mod_ids"
    ],
    "anyOf": [
      { "required": ["curseforge"] },
      { "required": ["maven"] }
    ],
    "properties": {
      "key": {
        "type": "string",
        "description": "Identifier of the shim within this repository: the '<key>_<loader>_dep' property prefix, the 'compat_mods' entry, the 'src/compat/<key>' source set and the 'com.yanny.alicompat.compat.<key>' package.",
        "pattern": "^[a-z0-9]+$"
      },
      "name": {
        "type": "string",
        "description": "Human readable mod name, used in the generated gradle.properties comments and in reports."
      },
      "mod_ids": {
        "type": "array",
        "description": "Runtime mod ids the shim gates on. More than one when a single CurseForge project ships several mod ids (Porting Lib).",
        "minItems": 1,
        "items": {
          "type": "string",
          "pattern": "^[a-z0-9_.-]+$"
        }
      },
      "curseforge": {
        "type": "array",
        "description": "CurseForge projects for this mod, as '<slug>-<project id>' (the artifact half of the 'curse.maven' coordinate). Usually one; a second entry is for mods published as a separate project per loader. Which project serves which loader is derived from CurseForge per Minecraft version, not declared here.",
        "minItems": 1,
        "items": {
          "type": "string",
          "description": "'<slug>-<project id>', e.g. 'the-bumblezone-forge-362479'. The slug is the last segment of the project URL. No file id: the pinned file is Minecraft-version specific and lives in gradle.properties.",
          "pattern": "^[a-z0-9-]+-[0-9]+$"
        }
      },
      "requires": {
        "type": "array",
        "description": "CurseForge projects the mod requires at runtime although its CurseForge files do not declare them, as '<slug>-<project id>'. Resolved per loader like the declared required dependencies, for the ALICompat gametest; a project with no file for a loader is skipped there.",
        "minItems": 1,
        "items": {
          "type": "string",
          "pattern": "^[a-z0-9-]+-[0-9]+$"
        }
      },
      "maven": {
        "type": "array",
        "description": "Maven repositories publishing this mod, consulted in order for every loader they list. The first source whose artifacts all share a version naming that Minecraft version (in the version or in the artifact name) wins, and the newest such version is taken. It is pinned when no CurseForge project has a file for the loader, or when its version is newer than the one in the CurseForge file name.",
        "minItems": 1,
        "items": {
          "type": "object",
          "additionalProperties": false,
          "required": ["repo", "loaders", "artifacts"],
          "properties": {
            "repo": {
              "type": "string",
              "description": "Repository root URL, e.g. 'https://mvn.devos.one/snapshots/'. build.gradle has to declare the same repository by hand.",
              "pattern": "^https://"
            },
            "loaders": {
              "type": "array",
              "description": "Loaders the artifacts are built for; a maven version does not say.",
              "minItems": 1,
              "items": {
                "type": "string",
                "enum": ["fabric", "forge", "neoforge"]
              }
            },
            "artifacts": {
              "type": "array",
              "description": "'<group>:<artifact>' without a version, all pinned at the same version into one comma-separated '<key>_<loader>_dep' line.",
              "minItems": 1,
              "items": {
                "type": "string",
                "pattern": "^[A-Za-z0-9_.-]+:[A-Za-z0-9_.-]+$"
              }
            }
          }
        }
      }
    }
  }
}
